{
  "$id": "https://github.com/ExaDev/claude-use/schema/CategoryClassification.schema.json",
  "$schema": "https://json-schema.org/draft/2020-12/schema",
  "type": "object",
  "properties": {
    "$schema": {
      "type": "string"
    },
    "secret": {
      "type": "array",
      "items": {
        "type": "string",
        "minLength": 1
      }
    },
    "runtime": {
      "type": "array",
      "items": {
        "type": "string",
        "minLength": 1
      }
    },
    "history": {
      "type": "array",
      "items": {
        "type": "string",
        "minLength": 1
      }
    },
    "knowledge": {
      "type": "array",
      "items": {
        "type": "string",
        "minLength": 1
      }
    },
    "settings": {
      "type": "array",
      "items": {
        "type": "string",
        "minLength": 1
      }
    }
  },
  "required": [
    "secret",
    "runtime",
    "history",
    "knowledge",
    "settings"
  ],
  "additionalProperties": false
}
