{
  "secret": [".credentials.json", "backups"],
  "runtime": [
    "daemon*",
    ".git*",
    ".DS_Store",
    "mcp-needs-auth-cache.json",
    "shell-snapshots",
    "statsig",
    "telemetry",
    "stats-cache.json",
    "usage-data",
    "ide",
    "cache",
    "scheduled_tasks.lock"
  ],
  "history": [
    "projects",
    "sessions",
    "session-env",
    "teams",
    "tasks",
    "todos",
    "history.jsonl",
    "transcripts",
    "paste-cache",
    "file-history",
    "plans",
    "workflows",
    "jobs",
    "debug",
    "downloads",
    "chrome"
  ],
  "knowledge": [
    "skills",
    "agents",
    "rules",
    "memory",
    "commands",
    "plugins",
    "hooks",
    "AGENTS.md",
    "CLAUDE.md",
    "README.md"
  ],
  "settings": ["settings.json", "settings.local.json"]
}
